{
  "$schema": "../DOCS/schemas/technician.schema.json",
  "schemaVersion": "2.0",
  "_comment": "Copy this file to technician.json and fill in your details. The real technician.json is gitignored and never committed. API key resolution, as implemented: the AI client reads the ANTHROPIC_API_KEY environment variable first, then looks for a key in this file. The risk planner additionally checks Windows Credential Manager under target 'FieldOpsPro:Anthropic' before falling back to the environment variable -- two resolvers with different orders, which is a known divergence tracked for a later release. Setting ANTHROPIC_API_KEY is the one path both agree on.",
  "operator": {
    "name": "<Your Full Name>",
    "email": "<your.email@example.com>",
    "employeeId": "<your-employee-id-or-empty>",
    "team": "<your-team-or-empty>",
    "company": "<your-company>"
  },
  "deployment": {
    "region": "<EU | US | APAC | other>",
    "role": "<your-role>"
  },
  "ui": {
    "locale": "en",
    "brandColor": "#6C3FC5"
  },
  "version": "2.0"
}
